Título,Descripción,Duración,Enlace
Juana Gallo,"La verdadera historia de Angela Ramos, una joven campesina que llegó a ser la cabeza de una guerrilla que luchó exitosamente contra las fuerzas federales del usurpador Victoriano Huerta. El pueblo la llamó por su fiereza “Juana Gallo”.",1hr 31 min,https://pluto.tv/on-demand/movies/5e5d7dbb4033cb001a4cf80d
Mi Padrino,"Al regresar de bracero, Capulina bautiza a otro niño del barrio, pues es padrino de muchos. Se entera que su ahijada huérfana Evita se ha ido a vivir a la elegante casa de su padrastro, el cual organiza un concurso de canto para complacer a su amante.",1hr 27 min,https://pluto.tv/on-demand/movies/5e5d9cbf6d961a001a2a68b3
El Super Mandilon,"El Supermandilon es un retrato hablado de todos los machos del mundo, que en su casa lava, plancha, barre y hace la comida antes de irse a trabajar, además tiene que soportar a la suegra que de todo le echa la culpa.",1hr 23 min,https://pluto.tv/on-demand/movies/60d49aa289632c0013eada08
El Camino,"David, y Eduardo Montalvo dos hermanos que al ser abandonados por su madre, tuvieron que ser criados por su padre Don Fernando Montalvo, se convierten en ladrones para poder pagar una deuda que su padre dejo al morir.",1hr 23 min,https://pluto.tv/on-demand/movies/620bd4b1e17acd0013989ef2
Los Desenfrenados,Viruta y Capulina son dos camioneros y conocen a unas hermosas fugitivas que huyen de un internado femenino.,1hr 47 min,https://pluto.tv/on-demand/movies/5e5d76761d1911001ad34fdb
El Dolor de Pagar la Renta,El dueño de una vecindad quiere lanzar a los inquilinos para construir otro dificio en el terreno. Capulina encuentra la manera de salvar a sus vecinos de perder sus hogares.,1hr 38 min,https://pluto.tv/on-demand/movies/5e5d76e74698db001ab22158
El Super Mandilon 2,"Ahora El Supermandilon ya manda en su casa, aprovechándose de que su suegra esta en la cárcel, y su esposa le ha prometido obedecerle en todo; pero comienza a pasarse de la raya con sus parrandas y fiestecitas que organizan en su oficina.",1hr 29 min,https://pluto.tv/on-demand/movies/60d49aa889632c0013eada74
Los Legionarios,"Viruta y Capulina huyen disfrazados de mujer de la legión extranjera, pero los confunden con esclavas y son vendidos para el harem del príncipe Omar. La odalisca Farida los descubre y avisa al sultán, quien los manda a decapitar.",1hr 35 min,https://pluto.tv/on-demand/movies/5e5d75025c1e25001a260907
En Peligro de la Muerte,En el lejano oeste Capulina es un minero que trata de encontra oro. El pequeño pueblo de El Dorado es robado constantemente por dos bandas enemigas. Capulina encuentra la manera de enfrentar a las bandas y salvar el oro.,1hr 28 min,https://pluto.tv/on-demand/movies/5f7754de07ce430013070926
Dos Locos en Escena,Durante el ensayo de una obra de teatro un actor pierde el conocimiento. Su compañero lo cree muerto y esconde el cuerpo en una caja. Capulina es el encargado de hacer la mudanza de las cajas y un juego de escondite se establece entre el y el “asesino.”,1hr 37 min,https://pluto.tv/on-demand/movies/5e5851da7255220014441d4d
Dos Criados Malcriados,"Capulina y Viruta entran a trabajar como sirvientes en la lujosa mansión de un millonario. Son torpes y casi arruínan la casa, pero al fin todos encuentran felicidad y amor con dos guapas sirvientas.",1hr 35 min,https://pluto.tv/on-demand/movies/5e584fc2ec9dd6001a98b06e
El Hermano Capulina,"Capulina abandona el digno oficio de limosnero, pero no por ello va a cometer la locura de trabajar. Va a dar a una orden de Frailes que se dedican a hacer la caridad y se enfrenta a los problemas de los Frailes y los de todos a su alrededor.",1hr 27 min,https://pluto.tv/on-demand/movies/5e5d76044698db001ab2210d
El Niño Sicario,Pedro es abandonado por sus padres en una central camionera de Sinaloa cuando apenas tenía 6 años. Pedro llega a los 15 años y se convierte en un desalmado sicario y rápidamente comienza a ascender en la organización.,1hr 28 min,https://pluto.tv/on-demand/movies/620bd4bce17acd001398a0aa
El Metiche,Capulina es un metiche que causa peores problemas a la gente que los que ellos tienen antes de que Capulina trata de ayudarlos.,1hr 19 min,https://pluto.tv/on-demand/movies/5e5d721a5c1e25001a260831
La Loca,Un joven psiquiatra se interesa en el caso de una paciente que cree vivir en el año 1936. Los parientes de ella quieren hacerla pasar por sana para poder cobrar una herencia de pero el médico lucha contra toda la familia para defender a 'La loca'.,1hr 32 min,https://pluto.tv/on-demand/movies/5e5d75016d961a001a2a5bc6
3 Mexicanos Calientes,Un creativo director de comerciales sostiene un tórrido romance con una modelo.,1hr 14 min,https://pluto.tv/on-demand/movies/60d49a9d89632c0013ead9da
Tin-Tan: 3 lecciones de amor,Tin-Tan es un vendedor de productos de belleza que conoce aun grupo de hermosas jóvenes que aspiran a ser modelos. Decide ayudarlas y organiza una exhibición de modas que las hace triunfar en la Televisión.,1hr 26 min,https://pluto.tv/on-demand/movies/6058ec03a224c9001bb77696
El Carita,"Capulina es un solitario que no puede encontrar novia. Un día, por un hechizo amanece como todo un galán. Todas las chicas lo buscan pero el solo quiere lograr el amor de una, a la que por mucho tiempo ha amado en secreto.",1hr 25 min,https://pluto.tv/on-demand/movies/5e5d719b67bbf8001aab2c91
Un horca para el texano,"Frank, Peter, Robert y Leop Morgan son buscados por todo un pueblo,ya que roban bancos y matan. Pronto un comisario llega para resolver el asesinato del presidente del banco y poner tras las rejas a estos cuatro bandidos.",1hr 23 min,https://pluto.tv/on-demand/movies/5e566c5e4faf09001a385149
El Sargento Capulina,Capulina quiere convertirse en superhéroe para combatir el crimen. Se enlista en la policía y después de un riguroso entrenamiento llega a ser sargento y confronta a los criminales en una serie de incidentes cómicos.,1hr 35 min,https://pluto.tv/on-demand/movies/5e5d724a407e62001baa93c6
Capulina contra Los Monstruos,Capulina lee historias acerca de los monstrous y cree que existen en la realidad. Está muerto de miedo hasta que descubre que son imaginarios.,1hr 28 min,https://pluto.tv/on-demand/movies/5e58512a3fa84e001a82e478
Tierra Baja,"Un hombre casado, el más rico del pueblo para proteger a su amante la oblige a casarse con uno de sus pastores. Un ignorante pero valiente pastor que se enfrenta a los lobos. Nadie anticipa que el pastor defenderá a su esposa.",1hr 38 min,https://pluto.tv/on-demand/movies/5e5d77994033cb001a4cf63a
El Corrido del 8,"La familia de Pedro, un traficante apodado el 8, es masacrada sin piedad. Pedro busca la ayuda de su hermano para que le busque a los mejores gatilleros de la región y así comenzar una encarnizada persecución en contra de los asesinos de su familia.",1hr 34 min,https://pluto.tv/on-demand/movies/620bd4b5e17acd0013989f61
El Rey de Monterrey,"Capulina y su novia, la sirvienta en una casa rica, deciden dar un paseo usando el automóvil de los patrones. Una banda de roba coches les roban el auto. Capulina y su novia tienen que recuperar el auto antes de que sus patrones se enteren.",1hr 34 min,https://pluto.tv/on-demand/movies/6058ebdcf96a44001a1ad740
Celos,"Después de que el un hombre encuentra una fotografía de su futura mujer con su ex-novio, los celos lo consumen e intenta descubrir todos los detalles de la vida de su novia antes de conocerse.",1hr 20 min,https://pluto.tv/on-demand/movies/5e566c664faf09001a38522f
La Vida de Pedro Infante,"Una historia emotiva y tierna basada en la vida real de Pedro Infante, el cantante y actor más famoso de México. Sus comienzos, sus triunfos, su pasión por los aviones, sus amores y su trágica muerte en plena flor de su edad.",1hr 44 min,https://pluto.tv/on-demand/movies/5e5d7afabb3c2e001bf9f0a4
El Investigador Capulina,Capulina confunde al vicepresidente de una empresa con un ladrón. Sus amigos los luchadores Tinieblas y Superzan acuden en su ayuda y evitan un asalto. Capulina creyéndose el héroe decide poner una agencia de investigadores.,1hr 22 min,https://pluto.tv/on-demand/movies/5e5d7126407e62001baa939a
Capulina Speedy Gonzalez,"En el Oeste, el cartero Speedy sólo lleva una carta de su novia Rosita para él mismo. Un cocinero que castiga a los que no aprueban sus platillos sin picante lo obliga a comer chile. Al comerlo se vuelve rápido y valiente.",1hr 33 min,https://pluto.tv/on-demand/movies/5e58531b407e62001baa1b15
El Karateca Azteca,"Capulina ayuda a un arqueólogo alemán y a su guapa hija, Nadia a visitar ruinas arqueológicas. Una banda de contrabandistas de piezas arqueológicas atrapa al padre de Nadia. Capulina combate a los malhechores con sus artes marciales.",1hr 30 min,https://pluto.tv/on-demand/movies/5e5d72726bcaef001bb19de6
Santo Contra Capulina,"Capulina es un gran admirador del campion el Santo, quien en su tiempo libre ayuda a la policia a resolver difíciles casos criminales. Un cientifico crea un robot igual a Capulina para matar al Santo. El robot y el Santo pronto se enfrentan en la arena.",1hr 17 min,https://pluto.tv/on-demand/movies/5e5d708e67bbf8001aab2c59
El Camino de los Espantos,Capulina maneja un camión de turismo. Se pierde en la carretera y se detiene en una casa abandonada donde fantasmas y espantos tratan de alejar a los turistas.,1hr 25 min,https://pluto.tv/on-demand/movies/5e5d7176580fad001afd8274
Yo fui violada,"Un violador embaraza a una de sus victimas. Su hija crece y se enamora de un joven drogadicto, quien se la ofrece , sin saberlo a su propio padre.",1hr 28 min,https://pluto.tv/on-demand/movies/5e566c5c4faf09001a38510f
Pancho pistolas I,"En un Jaripeo, el Charro Pancho dedica sus hazañas a su novia. Cerca del pueblo de La Presilla, unos hermanos codician las tierras de una tribu indígena.",1hr 23 min,https://pluto.tv/on-demand/movies/5e566c604faf09001a38517f
El Guia de las Turistas,Un grupo de hermosas turistas es defraudado por la compañía de turismo que las deja a la deriva y sin dinero. Capulina al saber del problema decide ponerse al frente de la gira como guía de turistas y tiene un éxito fabuloso.,1hr 30 min,https://pluto.tv/on-demand/movies/5e5d72ed72552200144483e8
Capulina contra Los Vampiros,Vampiros agresivos amenazan a Capulina hasta que él encuentra la manera de arrancarles los colmillos con unas pinzas de dentista. Los vampiros chimuelos se vuelven dóciles y beben leche en lugar de sangre.,1hr 24 min,https://pluto.tv/on-demand/movies/5e584e5b67bbf8001aaaaa30
Los Thornberrys,"Nigel y Marianne Thornberry realizan documentales de animales. Surcando el mundo en compañía de sus hijas, Eliza y Debbie, y de sus hijo adoptivo, Donnie, se devuelven al Congo para filmar un acontecimiento mágico que no se produce sino cada tres siglos.",1hr 25 min,https://pluto.tv/on-demand/movies/5ebd4d8cd6ea50001a32d80b
Garfield Gets Real,"Sigue a Garfield detrás de escena en Cartoon World, donde se aburre de su vida como estrella del cómic. Pensando que la vida es más verde al otro lado de la realidad, Garfield decide escapar al ""mundo real"".",1hr 18 min,https://pluto.tv/on-demand/movies/5f358844c88558001324ac05
Khumba,"Khumba es una cebra amigable que solo tiene rayas en la mitad de su cuerpo. Cuando la acusan de ser la responsable de la sequía que azota la tierra, decide buscar el legendario pozo de agua que da todos los latigazos a las cebras.",1hr 25 min,https://pluto.tv/on-demand/movies/6500a18688887a00131c437a
The Ten Commandments,"En esta adaptación animada de la Biblia, Moisés escucha la voz de Dios desde una zarza ardiente, lo que lo inspira a enfrentarse al faraón de Egipto y exigir la libertad de los esclavos israelitas.",1hr 24 min,https://pluto.tv/on-demand/movies/65089b65f439aa0013645b5c
Garfield's Pet Force,No todo está bien en el cosmos cómico. Una demoníaca malvada del cómic está decidida a conquistar Cartoon World y convertir a todos los personajes de cómic en sus esclavos,1hr 18 min,https://pluto.tv/on-demand/movies/5f3587e1bbff270013bb0a69
El rey mono,"En el mágico mundo de la mitología china, el famoso Rey Mono es expulsado del panteón por los monjes Tang y regresa a la montaña sagrada, donde vivirá una gran aventura para recuperar su lugar.",1hr 32 min,https://pluto.tv/on-demand/movies/6474c0d413c2c2001a64a18e
Rápido y peludo,"Cuando su familia se va de vacaciones, un perro joven se encuentra en una prisión para perros de la que debe escapar con la ayuda de sus nuevos amigos.",1hr 31 min,https://pluto.tv/on-demand/movies/62ffebc8c24630001a8b21b8
Foodfight!,El malvado Brand X se une a un supermercado que se convierte en ciudad después de la hora de cierre.,1hr 31 min,https://pluto.tv/on-demand/movies/62d7ff2680410e0013d7ee3a
Dinosaurios,"Tres niños curiosos activan una máquina del tiempo que los lleva 65 millones de años atrás, a la época de los dinosaurios. El T-Rex los confunde con sus propios críos por lo que los pequeños deben escapar antes de que los verdaderos hijos nazcan.",1hr 25 min,https://pluto.tv/on-demand/movies/5f3fd890ad190c001a52e628
Jasper: Viaje al fin del mundo,"Entre el helado Polo Sur y una ciudad de puerto se desarrolla la aventura de dos pingüinos hermanos, Jasper y Junior, que con la ayuda de Emma, una niña de 9 años, rescatan de las garras del malvado Doctor Block los huevos de un ave rara llamada kakapo.",1hr 24 min,https://pluto.tv/on-demand/movies/5fb6bf27dcedaf00138dc189
Legends of Oz: El regreso de Dorothy,"La niña Dorothy es llevada de regreso al mundo mágico de Oz, donde conoce a viejos amigos Tin Man, Scarecrow y Lion, sin embargo pronto descubre que todos los habitantes del reino corren un serio riesgo gracias a los actos del malvado bufón.",1hr 32 min,https://pluto.tv/on-demand/movies/60e4704083c54e001398ab70
Fish N Chips: La Película,Esta es la historia del conflicto por el hueso de un pez ancestral que devoró a un gato común.,1hr 25 min,https://pluto.tv/on-demand/movies/602ec318558c290014f90a40
Una Aventura en Hielo,"Buffet es un pingüino de carácter cuestionable. Recluta a sus amigos Euri, un yak perezoso y amigable, y Luke, un conejo de ritmo rápido y fanático de las artes marciales, para participar en una aventura hacia el Polo Sur.",1hr 34 min,https://pluto.tv/on-demand/movies/5fda40beaabcdd001aaf4866
Las Aventuras de Petey y sus amigos,"La base aérea de Desert Sky Air Force recibe instrucciones para llevar a cabo una misión urgente. Petey, un joven avión, hace un aterrizaje en el mismo lugar de la base.",1hr 13 min,https://pluto.tv/on-demand/movies/602eb79a1936020013184057
El Ángel en el Reloj,"Una niña enferma desea detener el tiempo. Este deseo la llevará a una aventura de autodescubrimiento y de aprendizaje sobre la vida, la muerte y la relatividad.",1hr 30 min,https://pluto.tv/on-demand/movies/6107ef8e94cf330013d2b5f0
Izzie's Way Home,"Un pez de acuario escapa de un yate a su casa, sin darse cuenta de los peligros que la esperan en el océano abierto. Con la ayuda de otras criaturas marinas, aprende a enfrentar los peligros de las profundidades.",1hr 17 min,https://pluto.tv/on-demand/movies/5e50530b0b9872c74eeaead1
Jack y la mecánica del corazón,"Edimburgo, año 1874. Jack es un chico no muy normal. Nació en la noche más fría de la historia y como consecuencia tiene el corazón congelado. Sin embargo, para que funcione, Madeleine, la comadrona, le instala un mecanismo especial.",1hr 32 min,https://pluto.tv/on-demand/movies/60e4703d83c54e001398ab36
De regreso al fondo del mar,Back to the Bottom of the Sea cuenta la conmovedora historia del viaje a casa de un pez dorado.,1hr 37 min,https://pluto.tv/on-demand/movies/5fda40c4aabcdd001aaf4916
Sargento Stubby,"La verdadera historia de un perro callejero que se une a su nuevo dueño en las batallas de la Primera Guerra Mundial. Por sus valientes acciones, el sargento Stubby todavía es reconocido como el perro más condecorado en la historia de Estados Unidos.",1hr 24 min,https://pluto.tv/on-demand/movies/5f7b8759e4b56900138b7bfa
Plumíferos - Aventuras Voladoras,"Juan es un simple gorrión de ciudad, pero con grandes dotes de vuelo, y que sueña con ser un pájaro exótico.",1hr 23 min,https://pluto.tv/on-demand/movies/6127946c964d2000141b98f2
Franklin regresa a la escuela especial,Se terminó el verano y Franklin y sus amigos regresan a clases.,47 min,https://pluto.tv/on-demand/movies/5e1788fd2db6f44ad610b89c
"Babar, La Película","La historia empieza con un desfile y, después cuando termina, el rey Babar le cuenta a sus hijos cómo fue su primer día como rey.",1hr 16 min,https://pluto.tv/on-demand/movies/5df7b722e955846fcffcc1f6
Teenage Mutant Ninja Turtles,"Después de meterse en un charco de desechos radiactivos, estos reptiles se transforman en el cuarteto de lucha contra el crimen más feroz de Nueva York.",1hr 34 min,https://pluto.tv/on-demand/movies/5fa95ea993fb64001a774c72
Franklin y el Caballero Verde,"En pleno invierno, una tortuga intrépida se embarca en una búsqueda para traer la primavera a su ciudad natal.",1hr 15 min,https://pluto.tv/on-demand/movies/5df7b724e955846fcffcc22e
Babar el Rey de los Elefantes,"Esta es la historia de Babar y su feliz infancia. Tiene una vida con muchas dificultades y aventuras, hasta convertirse en el gobernante de los elefantes.",1hr 19 min,https://pluto.tv/on-demand/movies/5df7b71fe955846fcffcc19a
"Sparks, La Historia de Ken Sparks","Durante 46 años, Ken Sparks dedicó su vida, a pesar de los sacrificios que le exigía, a entrenar el fútbol de tal manera que llevara a jugadores y fanáticos a Jesús y, al hacerlo, convirtió al hombre en una leyenda.",1hr 30 min,https://pluto.tv/on-demand/movies/65c39557ecf2e50013883adf
Lo Mejor de lo Mejor 2022,"Las mejores películas y canciones, las sonrisas más impresionantes. Noticias, deportes, fenómenos naturales, lanzamientos tecnológicos…",48 min,https://pluto.tv/on-demand/movies/64148bb1a5ab78001a23971a
Unicos: Zelensky,"En la primera de las entregas se presenta a Volodímir Zelenski, en la que de ser un comediante pasa a convertirse en el valiente líder que se atreve a enfrentar y resistir una invasión y una guerra, ganándose el apoyo y admiración de todos.",25 min,https://pluto.tv/on-demand/movies/64149164469e93001b78b8a2
Viva Elvis,"A lo largo de la historia han existido cantantes con infinidad de talento. Pero uno que lo tenga todo: carisma, magnetismo, magia y que emane luz propia. Aunque haya muchos imitadores, solo uno trasciende tiempo para vivir eternamente ¡Viva Elvis!",48 min,https://pluto.tv/on-demand/movies/6401f38bc33aa40013f20ff9
Lo Mejor de lo Mejor 2021,"Las mejores películas y canciones, las sonrisas más impresionantes. Noticias, deportes, fenómenos naturales, lanzamientos tecnológicos…",47 min,https://pluto.tv/on-demand/movies/64149b606c78eb001a420310
Pelotón de Ejecución,"Esta película está basada en el controvertido caso de Pvt. Joseph Pringle, soldado canadiense condenado por asesinato en Italia en 1945 y ejecutado por un pelotón de fusilamiento.",1hr 37 min,https://pluto.tv/on-demand/movies/6399ed61d576210013f88966
Descendencia,"Después de descubrir que puede tener casi doscientos medio hermanos y hermanas, el detective y documentalista aficionado Barry Stevens se propone descubrir la identidad del donante de esperma anónimo detrás de su clan secreto.",55 min,https://pluto.tv/on-demand/movies/639b86998ba71d0013e531ff
Momentos que Cambiaron la historia - Valor inusual: la batalla por Iwo Jima,"Para el verano de 1944, los dieciocho kilómetros cuadrados de Iwo Jima se habían convertido en las tierras más importantes del Océano Pacífico y serían sede de la lucha más larga y más salvaje de la guerra en el Pacífico.",47 min,https://pluto.tv/on-demand/movies/639b8da24da5ab0013032611
Momentos que Cambiaron la historia - De la desesperación a la actitud desafiante: el levantamiento del gueto de Varsovia,"El 19 de abril de 1943, los jóvenes del gueto de Varsovia llevaron a cabo una rebelión armada contra las fuerzas de liquidación nazis.",47 min,https://pluto.tv/on-demand/movies/639b8ad4e83c95001391ab12
Prisionero del paraíso,"Este documental nominado al Oscar narra la historia impactante de Kurt Gerron, conocido actor, director y estrella de cabaret judío alemán que fue enviado a un campo de concentración.",1hr 27 min,https://pluto.tv/on-demand/movies/639b896988bc20001347df59
No hay dónde esconderse,"En este contundente documental de dos partes, inspectores de piratería, hackers, ex agentes secretos y luchadores por la libertad y la privacidad ofrecen historias verdaderas sobre cómo.",45 min,https://pluto.tv/on-demand/movies/639b81018ffdc40013e69596
Huyendo de Bountiful,"Criada en la comunidad polígama de culto fundamentalista de Bountiful, Columbia Británica, Debbie Palmer sobrevivió al abuso sexual y a la persecusión para escaparse con sus seis hijos y empezar una vida comprometida con el activismo.",47 min,https://pluto.tv/on-demand/movies/639b32a086acfd00135d90b6
Fin del Juego: Kasparov y la máquina,"En 1997, el campeón de ajedrez Garry Kasparov compite con la computadora de IBM y acusa a IBM de hacer trampa. Las entrevistas con Kasparov y miembros del equipo de IBM iluminan la controversia.",1hr 25 min,https://pluto.tv/on-demand/movies/6399f19c4da5ab0013023cd6
Encubrimiento: el secreto nazi de Noruega,"Miles de niños y niñas, nacidos de un plan nazi para criar ""niños racialmente superiores"" con arios noruegos durante la Segunda Guerra Mundial, fueron maltratados en los años de la posguerra.",50 min,https://pluto.tv/on-demand/movies/6398c1d9e83c95001390eb41
La Búsqueda de la Última Cena,La restauración de 19 años del fresco de La Última Cena de Leonardo da Vinci ha revelado que solo el 20% de la pintura original todavía es visible. ¿Nunca podremos ver cómo era la pintura original?,56 min,https://pluto.tv/on-demand/movies/5fa472839a01a3001b718f7e
"Andy Warhol, Fluorescente","Documental sobre el ícono, creador y víctima del arte pop. Revolucionario y controversial. Warhol nunca tuvo miedo de romper el molde y rediseñar las diferentes áreas del arte.",44 min,https://pluto.tv/on-demand/movies/5e26201e3a83a92d512655a9
Oh Dios Mío,"""Oh My God"" le pregunta a gente de todo tipo de entornos y culturas ""¿Qué es Dios?""",1hr 38 min,https://pluto.tv/on-demand/movies/62cc500b18de52001378bc97
La Vida de Nuestro Señor Jesucristo,"La vida de nuestro señor Jesucristo es un montaje con secuencias de las películas El pecado de Adán y Eva (1969), Jesús, nuestro Señor (1969), Jesús, el niño Dios (1970) y Jesús, María y José (1970), películas dirigidas de Miguel Zacarías.",2hr 12 min,https://pluto.tv/on-demand/movies/5ffcefa5cc17ce00130b6aae
Eastwood,"A lo largo de la vida, el legendario Clint Eastwood ha cosechado muchos triunfos y derrotas. Ganador de cuatro Oscars de la Academia y otros 153 premios,el maestro Clint Eastwood tiene asegurado su puesto de honor en la de la cinematografía mundial.",47 min,https://pluto.tv/on-demand/movies/62c83e02bcc6980013291a0b
El Papa De Todos,"El 13 de marzo del 2013 Jorge Mario Bergoglio, Arzobispo de Buenos Aires, se convierte en el Papa Francisco. Sus primeros días de pontificado dan muestra de una actitud austera, próxima al pueblo, y en pos de una cultura del encuentro con Dios.",54 min,https://pluto.tv/on-demand/movies/5f3d77410b2a6c001ab9568c
Vigilante,"Ya sea en las tiras cómicas, en las series animadas, en el cine o en la televisión las narrativas de Batman se han multiplicado desde su creación y coexisten en muchos universos para diferentes audiencias. Vigilante es la biografía de Batman.",47 min,https://pluto.tv/on-demand/movies/62bb2e994a9f0a00139d8c1c
Sergio Herman: Jodidamente Perfecto,"El chef Sergio Herman siente la necesidad de dejar su restaurante de 3 estrellas, Oud Sluis, para poder cumplir sus sueños. Una historia reveladora sobre la perfección, la ambición y los sacrificios.",1hr 23 min,https://pluto.tv/on-demand/movies/5f3fd8dfad190c001a52ee01
El Papa Del Fin Del Mundo,"El 13 de Marzo de 2013, el arzobispado de Buenos Aires, Jorge Mario Bergoglio un cura de vocación misionera, se vuelve un faro de esperanza para la comunidad cristiana al convertirse en papa.",47 min,https://pluto.tv/on-demand/movies/5f185dec6ebd4d00132892e0
El Mariachi,"Un recorrido por la historia y el presente del símbolo musical México. Siguiendo sus pasos a través de la tierras calientes de Jalisco, el antropólogo Jesús Jauregui indaga en la historia y reúne testimonios de los músicos modernos y tradicionales.",47 min,https://pluto.tv/on-demand/movies/5f3d77460b2a6c001ab956ec
Shadows of soldiers,"SOS explora varios temas relacionados con los efectos secundarios de la guerra, sumergiéndose en el mundo de los niños cuyos padres participaron en combate, pasando por Oklahoma, Kansas y California, entre otros estados.",1hr 52 min,https://pluto.tv/on-demand/movies/60fb0d06bfce9f0013d91b9f
"Tastil, la majestuoso y misteriosa","Muy cerca de la cordillera de Los Andes, a casi 4.000 metros de altura, existió la majestuosa ciudad de TASTIL. Increíblemente, fue abandonada, y no se sabe porque.",46 min,https://pluto.tv/on-demand/movies/5fdbbe8c0983410013dd91ce
El Carnaval De Barranquilla,"El Carnaval más importante de la América Hispana. Durante cuatro días, la herencia negra, española e indígena contagia las calles de la ciudad colombiana para transformarse en la fiesta más esperada del año.",1hr 10 min,https://pluto.tv/on-demand/movies/5f523f011629e7001abed2f2
Yo Soy La Salsa,"Más que un género musical, la salsa fue un movimiento cultural que surgió de los barrios más humildes del Caribe.",1hr 20 min,https://pluto.tv/on-demand/movies/5e609aef4698db001ab295d1
