Título,Descripción,Duración,Enlace
Pet Obsessed,"Con clips ridículos, cortos digitales y toneladas de pelusa; estas son las mascotas más escandalosas y francas de Internet... Tu nueva obsesión.",4 Temporadas Disponibles,https://pluto.tv/on-demand/series/645ab1ce5348f4001a21019c/episode/645ab1d15348f4001a2110b0
Yo amo a Shakey,"JT O’Neil, con su hija de 10 años, y su devoto perro Shakey se mudan a una pequeña ciudad de Chicago y al no leer la letra pequeña de su contrato de alquiler, JT se ve obligado a tratar de deshacerse de su perro.",1hr 42 min,https://pluto.tv/on-demand/movies/5f3fd896ad190c001a52e6da
Shelby,"Shelby es un perro sin dueño que tiene por costumbre fugarse de la perrera cada vez que tiene la oportunidad. Durante una de sus escapadas conoce a Jake, un niño que sueña con ser un gran mago, y se hacen amigos inseparables.",1hr 32 min,https://pluto.tv/on-demand/movies/5fad4a7f8b78ef001aa27bcd
Chiguagua: el fantasma,"Al heredar una antigua casa de vacaciones, los Fastener se dan cuenta que la perra de sus antepasados, Sophie los persigue. Homer, su golden retriever, se hace amigo de Sophie y descubre que ella solo está buscando una familia a la que amar",1hr 22 min,https://pluto.tv/on-demand/movies/62bcab10e9e8c00013709d5a
Max salva al Mundo,Sean y su perro Max quieren ser detectives pero en su vecindario no sucede nada hasta que desaparece un diamante. Ahora tendrán que enfrentarse a un grupo de alienígenas que vienen al planeta con planes de quemar la Tierra.,1hr 28 min,https://pluto.tv/on-demand/movies/60c8abd436537d0013320af4
"Benny , El Feo","Es la historia de un perro sin buena apariencia, sus dueños no tenian idea de que hacer con el cachorro extraño. Pero su ternura logro que una familia lo adoptara y desde ese momento la vida de Benny ha cambiado totalmente.",1hr 39 min,https://pluto.tv/on-demand/movies/62bf09238672a30013bd7ef8
Un amor hasta las patas,"Su amiga Roxana decide conseguirle una cita a través de las redes sociales. El desastre de la cita la lleva a pedirle un deseo a un mágico ""gato de los deseos"": tener un novio tan tierno y comprensible como sus 2 adorables perros.",1hr 26 min,https://pluto.tv/on-demand/movies/603e6222049634001a5f3418
Mi Angel Guardián,"Cooper, un perro, es el único sobreviviente de un terrible accidente automovilístico. Jake pierde a su esposa e hijos en el accidente. Jake es de enojo hacia el perro, pero este vinculo termina siendo lo unico que lo ayuda a seguir viviendo.",1hr 25 min,https://pluto.tv/on-demand/movies/60c8abc136537d0013320966
Amor por el Perro,"Cuando una madre divorciada intenta iniciar una nueva relación, sus hijos y su perro comienzan a sabotear el romance. Tienen éxito, hasta que aparece un ex novio de la escuela.",1hr 21 min,https://pluto.tv/on-demand/movies/5fda4095aabcdd001aaf4430
"¿EI, Dónde está mi Perro?","Un joven llamado Ray se queda en casa para cuidar al perro de la familia, Harry, para demostrarles a sus padres que no es, como dicen, ""irresponsable"".",1hr 22 min,https://pluto.tv/on-demand/movies/5fda414b0dddaf0013b83734
El refugio,"La familia Davis es un desastre, pero un perro callejero logrará en poco tiempo restaurar su matrimonio, arreglar una relación padre-hijo deteriorada, alegrar la vida de un niño de 9 años y salvar a un niño muy pequeño.",1hr 24 min,https://pluto.tv/on-demand/movies/62ffebd0c24630001a8b226c
Un equipo incomparable,"Seeker, un perro que no puede oler, y Fetch, un cerdo casi ciego ayudan a mascotas perdidas a encontrar sus hogares.",1hr 20 min,https://pluto.tv/on-demand/movies/62fe9e866df8ae001a0464ae
De patitas a la calle,"Una perra llamada Lasmi se perdió en la ciudad de Lima. Un grupo de patrulla canina la ayuda a encontrar a su familia. Pero un grupo de traficantes está secuestrando perros, por lo que deben descubrirlos y atraparlos.",1hr 23 min,https://pluto.tv/on-demand/movies/60e459453988a50013b7617f
K-9 Aventuras: Un Cuento de Navidad,"Kassie, sus amigos y su perro, Scoot, organizan una recaudación de fondos para las fiestas, pero deben proteger el dinero de algunos ladrones para poder salvar la Navidad.",1hr 29 min,https://pluto.tv/on-demand/movies/61f2a44d04ff25001a4fe790
Smitty,"Ben, un chico de trece años, lleva a cabo continuas travesuras que traen de cabeza a su madre, una mujer soltera que lucha cada día por intentar salir adelante sin una pareja que le ayude a tratar que el comportamiento de su hijo mejore.",1hr 34 min,https://pluto.tv/on-demand/movies/60c8abbc36537d00133208f2
La Mejor Amiga de Summer,"El brillante e independiente Summer Larsen, de 12 años, rescata a un dulce perro callejero y no se detendrá ante nada para salvarlo. Y es su determinación lo que finalmente impacta a quienes la rodean.",1hr 41 min,https://pluto.tv/on-demand/movies/60bf7276d782df0013ef296c
El perrito Pudsey,"En la ciudad de Londres Pudsey es feliz con su vida de perro callejero, pero un día su vida cambiará radicalmente. Molly, George y Tommy son tres hermanos que deciden acogerlo en la familia. Todo cambia tras la muerte de su padre.",1hr 27 min,https://pluto.tv/on-demand/movies/5f7b86a0e4b56900138b713a
El Sol de Medianoche,"En las heladas tierras del norte de Canadá, el joven Luke desafiará los peligros de la naturaleza y la dura inclemencia del tiempo invernal para ayudar a un joven oso polar a que se reúna con su madre.",1hr 36 min,https://pluto.tv/on-demand/movies/60bf7226d782df0013ef25df
Una verdadera amistad,"Finn es un niño de 13 años que es acosado constantemente en la escuela, pero su vida comienza a cambiar el día que conoce a un labrador llamado Marshall, que vive en condiciones extremas y necesita atención médica.",1hr 30 min,https://pluto.tv/on-demand/movies/5fda409aaabcdd001aaf44a0
El robo más grande de la historia,"Un guardia de seguridad es convencido por su imprudente mejor amigo de robar la compañía para la cual trabaja, junto a una violenta banda criminal y un duro detective en su camino...¿Podrán escaparse de la cárcel o de un destino peor?",1 Temporada disponible,https://pluto.tv/on-demand/series/66c4ab3fe8203c00137f8bc0/episode/66c4ab40e8203c00137f8bde
Apex,"Cinco cazadores de élite pagan para cazar a un hombre en una isla desierta. Pero cuando su presa comienza a defenderse, los roles de cazadores y de la presa cambian de lado…",1hr 33 min,https://pluto.tv/on-demand/movies/66a7d1a62fca0600131c856a
La jugada maestra,"Ambientado durante la Guerra Fría, el campeón de ajedrez norteamericano Bobby Fischer se encuentra atrapado entre dos superpotencias y sus propias luchas mientras desafía al Imperio Soviético.",1hr 55 min,https://pluto.tv/on-demand/movies/62ffb0b3362313001aaa7ad0
Un pasado imborrable,"Un ex oficial del ejército británico, que fue torturado como prisionero de guerra durante la Segunda Guerra Mundial, descubre que el soldado japonés que tanto lo maltrató sigue vivo y se dispone a confrontarlo.",1hr 56 min,https://pluto.tv/on-demand/movies/62cc54454f12bb00136640c9
Scream 4,"Con terapia y ayuda, la joven Sidney Prescott (Neve Campbell) ha conseguido dejar atrás todas las muertes que contempló años atrás en su pueblo natal, Woodsboro.",1hr 51 min,https://pluto.tv/on-demand/movies/5f7b872be4b56900138b7983
Lila y Eve,"Lila y Eve dos madres destrozadas por el asesinato de sus hijos, unen fuerzas para vengarse de los traficantes de droga responsables de la muerte del hijo de Lila.Pero a medida que la violencia crece Lila empieza a descubrir la verdadera identidad de Eve.",Thriller,https://pluto.tv/on-demand/movies/5e6ff36e4698db001ab3de55
Terminal,"En una oscura ciudad, dos sicarios intentan cumplir una escalofriante misión. Vince y Alfred tienen la instrucción de permanecer en un hotel hasta que alguien aparezca en una habitación en el edificio de enfrente; solo entonces deben de matarlo.",Thriller,https://pluto.tv/on-demand/movies/63aded948ba71d0013eafbf3
Diario de un seductor,"Paul Kemp es un escritor norteamericano que ha empezado a trabajar como redactor para un periódico caribeño. Su nuevo ambiente, poco a poco, empieza a enrarecerse. Amor, envidia, celos y mucho alcohol son los principales ingredientes del relato.",1hr 59 min,https://pluto.tv/on-demand/movies/5e6a42a7e2fa10001becd0f3
Peligro en la montaña,"Joe Braven es un humilde leñador que vive en la frontera de los Estados Unidos. Cuando es asaltado por un grupo de traficantes de drogas en la recluida cabaña donde vive, hará todo lo que puede para proteger a su familia.",1hr 33 min,https://pluto.tv/on-demand/movies/5f7b879be4b56900138b7fba
Zona de miedo,"En Irak, una unidad de élite de artificieros norteamericanos actúa en una caótica ciudad donde cualquier persona puede ser un enemigo y cualquier objeto, una bomba.",2hr 11 min,https://pluto.tv/on-demand/movies/604b91f9b2b870001a05f1cb
Aceleracion Maxima,"Una madre tiene una noche para hacer algunas tareas en Los Ángeles que requieren un arma, si quiere ver a su hijo con vida. Está retenido por un jefe de la mafia.",1hr 25 min,https://pluto.tv/on-demand/movies/6475fd3091275e001a0599ee
En el Rastro del Asesino,Un policía trabaja para averiguar si un adolescente violento asesinó a su familia.,1hr 41 min,https://pluto.tv/on-demand/movies/641c6c621a5081001a49bf50
Tres Ladrones y un Bebé,"Fong es un ladrón con mala suerte. Con unas habilidades excepcionales, Fong siempre pierde todas sus ganancias en sus robos de apuestas. Su gran oportunidad llega cuando un gángster les pide a él y a su compañero pulpo que secuestren a un importante bebé.",2hr 6 min,https://pluto.tv/on-demand/movies/641c6c5f1a5081001a49be52
La Hora de la Verdad,"El plan de los tres ladrones lo tiene todo para salir adelante -secuestrar al nieto de un millonario y ganar dinero fácil- pero no contaban con el carisma del bebé, lo que enternece el corazón del trío y dificulta la tarea.",2hr 3 min,https://pluto.tv/on-demand/movies/641c6c541a5081001a49ba5c
Balas en Furia,"En la China de la década de 1920, un bandido llega a una remota ciudad de provincia haciéndose pasar por su nuevo alcalde, donde se enfrenta a un tiránico noble local.",2hr 12 min,https://pluto.tv/on-demand/movies/641084fa8a5b2f001398b79b
Una familia peligrosa,Un jefe de la mafia y su familia son trasladados a un pueblo tranquilo en Francia bajo el programa de protección de testigos después de delatar a la mafia.,1hr 51 min,https://pluto.tv/on-demand/movies/6352bdcacba1290014dc1751
Inseparable,"Chuck se inmiscuye en la vida de su vecino Li, un ingeneniero con problemas laborales y personales.",1hr 36 min,https://pluto.tv/on-demand/movies/62cc680618de52001378c4e6
Fire with Fire,"Un bombero fuera de servicio es testigo de un asesinato a manos de una banda de mafiosos. Entra en el programa de protección de testigos hasta que testifique, pero no consigue ocultarse por mucho tiempo de la banda, por lo que decide actuar por su cuenta.",1hr 37 min,https://pluto.tv/on-demand/movies/5dfd2e82be7e53bc0c65d59d
What Just Happened,"Una semana en la vida de Ben, un poderoso productor de Hollywood, mientras hace malabarismos con las negociaciones con un director de estudio para que su última película pueda estrenarse en Cannes en dos semanas.",1hr 44 min,https://pluto.tv/on-demand/movies/62b336542fbef40013892986
Justo a tiempo,"Gene llega a su casa después de asistir al funeral de su exesposa. Al poco tiempo, secuestran a su hija. Recibe una pistola y la tarea de matar a una persona en una hora y quince minutos. De lo contrario, su hija será asesinada.",1hr 29 min,https://pluto.tv/on-demand/movies/5e5d43ed4698db001ab20e82
Mapa a las estrellas,"Un recorrido por el corazón de una familia de Hollywood que persigue a la celebridad, a los demás y a los implacables fantasmas de su pasado.",1hr 51 min,https://pluto.tv/on-demand/movies/6310d43755ecdb0013ce4a55
El árbol de la vida,"La historia de una familia en Waco, Texas en 1956. El hijo mayor es testigo de la pérdida de la inocencia y lucha con las enseñanzas contradictorias de sus padres.",2hr 18 min,https://pluto.tv/on-demand/movies/6310fba36e998c00133133e8
Bus 657: El Escape del Siglo,Un padre no tiene los medios para pagar el tratamiento de su hija. Como último recurso se asocia con un codicioso compañero de trabajo para robar un casino. Cuando las cosas van mal se ven obligados a secuestrar un autobús de la ciudad,1hr 32 min,https://pluto.tv/on-demand/movies/62cc65397abcdc0013991d69
Cloud Atlas,"Una exploración de cómo las acciones de las vidas individuales se impactan entre sí en el pasado, el presente y el futuro, un alma pasa de ser un asesino a convertirse en un héroe, un acto de bondad se extiende para inspirar una revolución",2hr 52 min,https://pluto.tv/on-demand/movies/62cc47bd75b9dc0013c81343
Agora,"Drama histórico sobre un esclavo que se vuelve hacia la creciente ola del cristianismo con la esperanza de buscar la libertad mientras se enamora de su amante, la profesora de filosofía y matemáticas Hipatia de Alejandría.",2hr 6 min,https://pluto.tv/on-demand/movies/62cc479e75b9dc0013c81144
Las Zafiro,"Las Zafiro, cuatro chicas aborígenes australianas que apdrendieron sobre el amor, la amistad y la guerra, cuando Gail, Julie, Cynthia y Kay formaron un grupo musical de entretenimiento para las tropas de Estados Unidos en Vietnam en 1968",1hr 38 min,https://pluto.tv/on-demand/movies/62cc2b8d9f6f4700149305c1
La Batalla de los Malditos,"Después de un brote viral mortal, el soldado militar privado Max Gatling lidera a un puñado de sobrevivientes y una banda heterogénea de robots contra un ejército de infectados.",1hr 28 min,https://pluto.tv/on-demand/movies/62cc230f997d5700138b4e82
El Experimento,Remake de la película alemana de 2001 Das experiment dirigida por Oliver Hirschbiegel. Cuenta la historia de 20 hombres que llegan a una cárcel ficticia buscando la forma de ganar dinero rápido. Deberán participar en un experimento sociológico.,Thriller,https://pluto.tv/on-demand/movies/5f7b87bfe4b56900138b8256
Match Point,un ex tenista profesional se enamora de una actriz que casualmente está saliendo con su amigo y futuro cuñado.,2hr 4 min,https://pluto.tv/on-demand/movies/6310d86b04308c00135df072
El expreso del miedo,"Un experimento para solucionar el calentamiento global acabó matando a la mayoría de la vida existente en el planeta, los únicos sobrevivientes fueron los pasajeros del Snowpiercer.",2hr 6 min,https://pluto.tv/on-demand/movies/5e6a42ace2fa10001becd16f
The English Teacher,"Linda, una profesora de inglés cuya reprimida vida personal convive con un marcado contraste con la pasión que lleva al salón de clases. Su vida cambia cuando el alumno estrella regresa a su pueblo tras fracasar como dramaturgo.",1hr 31 min,https://pluto.tv/on-demand/movies/5f7357c776c54900134c3633
El Gran Impostor,"Ray era un niño prodigio de la pintura. Al igual que su padre, se convirtió en ladrón, y ahora para conservar su libertad debe hacer un último trabajo para las personas que lo ayudaron a salir.",1hr 35 min,https://pluto.tv/on-demand/movies/6141f427bce9e900135a5b29
Nunca me dejes Sola,"Kate es diagnosticada con Esclerosis Múltiple y Bec asume un trabajo ayudando a Kate. En ese momento,el matrimonio de ella con Evan llega al límite, y ambas forman un vínculo poco convencional, a veces conflictivo y ferozmente honesto.",1hr 42 min,https://pluto.tv/on-demand/movies/6141f44dbce9e900135a5e4a
El defensor,Un abogado de defensa tiene una crisis de conciencia cuando se representa a un cliente adinerado que tiene un plan infalible para vencer al sistema.,1hr 58 min,https://pluto.tv/on-demand/movies/5e67ea225cee68001a91ac3e
Por orgullo,"La verdadera e inspiradora historia de Jim Ellis, un carismático maestro de escuela que cambió vidas para siempre cuando fundó un equipo de natación afroamericano en uno de los vecindarios más duros de Filadelfia.",1hr 49 min,https://pluto.tv/on-demand/movies/5fc918182fd74a0014cd910e
Consigue un Trabajo,"Miles Teller, Anna Kendrick y Bryan Cranston protagonizan esta comedia fresca y perversamente divertida sobre conseguir un trabajo en una economía difícil.",1hr 22 min,https://pluto.tv/on-demand/movies/5fc918112fd74a0014cd906d
24 horas para vivir,"Un asesino profesional muere durante uno de sus trabajos, pero es devuelto a la vida por un día para cumplir una importante misión.",1hr 32 min,https://pluto.tv/on-demand/movies/5f7b8695e4b56900138b70c2
Rescate Sangriento,"Un ganster ruso retirado, actualmente escritor de novelas, es tentado a volver a la vida criminal cuando descubre que su hija va a casarse con el hijo de su enemigo.",1hr 38 min,https://pluto.tv/on-demand/movies/60c8abc436537d001332099c
Misión Secreta,Un senador estadounidense es asesinado en Washington por un espía ruso. Un agente de la CIA retirado (Richard Gere) se ve obligado a colaborar con un joven agente del FBI (Topher Grace) para atrapar al criminal.,1hr 38 min,https://pluto.tv/on-demand/movies/5e6ff3694698db001ab3dddf
El transportador 3,Frank Martin es un indiscutible especialista en entregas de alto riesgo. En esta ocasión está obligado bajo amenazas a trasladar dos voluminosas bolsas y una joven ucraniana desde Marsella hasta Odessa,1hr 43 min,https://pluto.tv/on-demand/movies/5e6a42b4e2fa10001becd22d
Rambo 4,"El veterano de Vietnam John Rambo ha sobrevivido a muchas pruebas terribles en su vida y desde entonces se ha retirado a una isla simple y aislada en Tailandia, donde pasa su tiempo capturando serpientes para artistas locales.",1hr 31 min,https://pluto.tv/on-demand/movies/5e552dc35c1e25001a24f31a
Todo Corazón,"Basada en el relato de Mariane Pearl sobre la terrible e inolvidable historia de su esposo, el periodista del Wall Street Journal Danny Pearl, su vida y su muerte.",1hr 48 min,https://pluto.tv/on-demand/movies/62f5240f6df8ae001a028380
En busca de venganza,Un padre de familia (Arnold Schwarzenegger) buscará venganza contra el controlador del aeropuerto (Scoot McNairy) responsable del fallecimiento de su mujer e hija. Film basado en hechos reales.,Thriller,https://pluto.tv/on-demand/movies/5e6ff3654698db001ab3dd65
Machine Gun Preacher,Sam Childers es un ex motorista traficante de drogas que encontró a Dios y se convirtió en un cruzado salvando a cientos de niños sudaneses obligados a convertirse en soldados.,2hr 9 min,https://pluto.tv/on-demand/movies/5dfd2e7ebe7e53bc0c65d521
Out of the Furnace,"Russell (Christian Bale), un trabajador del acero, toma un asunto familiar en sus propias manos cuando su hermano, Rodney (Casey Affleck) se involucra con uno de los sindicatos del crimen más rudos del noreste y luego desaparece.",Thriller,https://pluto.tv/on-demand/movies/5ea2ee9bc733d6001a1ae620
Blitz,"Blitz es un asesino en serie de Londres que está matando agentes de la policía. El inspector jefe Roberts y el sargento Brant, un duro, inflexible y políticamente incorrecto detective de la policía, se encargarán de intentar detener al psicópata.",1hr 37 min,https://pluto.tv/on-demand/movies/5dfd2e74be7e53bc0c65d42d
6 Balas,"Cuando secuestran a la hija de un profesional de artes marciales, sólo hay un hombre que puede ayudar a encontrarla: un ex-mercenario.",1hr 55 min,https://pluto.tv/on-demand/movies/5f3fd887ad190c001a52e538
Un pedacito de cielo,"Marley (Kate Hudson) es una mujer joven que descubre que se está muriendo de cáncer, pero cuando de forma inesperada se enamora de su médico (Gael García Bernal), la amenaza de caer en el amor es más aterradora que la muerte.",1hr 46 min,https://pluto.tv/on-demand/movies/5e7b5ed187df5d001bb8f333
Promesa de vida,Un hombre australiano viaja a Turquía después de la Batalla de Gallipoli para intentar encontrar a sus hijos perdidos.,1hr 51 min,https://pluto.tv/on-demand/movies/5e6a42b6e2fa10001becd269
Agua Profunda,Black Water es una película de acción que gira en torno a un agente (Jean-Claude Van Damme) que despierta atrapado en una prisión secreta de la CIA a bordo de un submarino.,1hr 44 min,https://pluto.tv/on-demand/movies/5f7b877fe4b56900138b7df9
El Ilusionista,"En Viena de 1900, Eisenheim cautiva con sus espectáculos de magia e ilusionismo. Sus poderes sobrenaturales llegan a oídos del príncipe heredero Leopold.Sospechando un fraude,Leopold encarga al inspector de policía Uhl que vigile de cerca al mago.",1hr 49 min,https://pluto.tv/on-demand/movies/604b91eab2b870001a05f05f
El aprendiz,"Un ex-agente de la CIA vuelve a la acción para proteger a un testigo muy valioso, pero pronto se da cuenta de que los tiempos han cambiado y ya no puede confiar en nadie, ni siquiera en aquellos a los que consideraba sus amigos.",1hr 48 min,https://pluto.tv/on-demand/movies/5e6a42a6e2fa10001becd0b7
Una Acción Civil,"Jan es abogado de lesión personal que solo acepta casos grandes en los que puede llegar a un acuerdo fuera de la corte. Su último caso parece simple, pero se volverá una batalla épica, una por la que estará dispuesto a arriesgar su carrera.",1hr 55 min,https://pluto.tv/on-demand/movies/62f523dd6df8ae001a027bb8
Precious,"una adolescente analfabeta, maltratada y con sobrepeso que está embarazada de su segundo hijo es invitada a inscribirse en una escuela alternativa con la esperanza de poder cambiar su vida en una mejor dirección.",1hr 50 min,https://pluto.tv/on-demand/movies/6310dca88762280014a48a22
Regresión,Un detective y un psicoanalista descubren pruebas de un culto satánico mientras investigan el aterrador pasado de una joven.,Thriller,https://pluto.tv/on-demand/movies/6310df827a42340013e95fe1
Asesino a sueldo,Un caso de identidad equivocada lleva a Slevin al centro de una guerra tramada por dos de los jefes criminales más rivales de la ciudad.,1hr 50 min,https://pluto.tv/on-demand/movies/6310cffb37c5800013b697b2
"Yo , Frankenstein",La criatura de Frankenstein se encuentra atrapada en una guerra total de siglos de antigüedad entre dos clanes inmortales.,1hr 32 min,https://pluto.tv/on-demand/movies/6317a122bb171a00130f81c7
The cobbler,Cuenta la historia de un zapatero que tiene la peculiar habilidad de asumir la vida de sus clientes a través de los zapatos que repara.,1hr 38 min,https://pluto.tv/on-demand/movies/5e0a2c00be8fa6764e877186
Hombre Peligroso,"Tras cumplir seis años en prisión por un crimen que no había cometido, Shane Daniels es absuelto con una disculpa del Estado de Arizona. Shane debe luchar a su manera en un país corrupto y asegurarse de que la chica salga con vida.",1hr 34 min,https://pluto.tv/on-demand/movies/60c8abbe36537d001332092c
Bring it on,"Dos equipos de animadoras se enfrentarán para conseguir el gran premio nacional de ""cheerleaders"".",1hr 38 min,https://pluto.tv/on-demand/movies/5e0a2bfcbe8fa6764e87710e
The Expendables,"En 'The Expendables' el trío de héroes de acción compuesto por Stallone, Statham y Li formarán parte de un comando de mercenarios que se infiltrarán en un país de Sudamérica y lucharán contra un un cruel dictador para liberar a la población.",1hr 43 min,https://pluto.tv/on-demand/movies/650dd1f64827fc001a7df74a
Derailed,"¡En un tren fuera de control que retiene rehenes y el agente de armas biológicas de alta tecnología, Kristoff (Van Damme) se convierte en un ejército de un solo hombre para descarrilar a los terroristas y salvar las vidas de todos a bordo!",1hr 28 min,https://pluto.tv/on-demand/movies/5e555cbc5c7c10001a5f69b3
Hermandad De Justicia,"Keanu Reeves, Kiefer Sutherland y Billy Zane son los mejores estudiantes de secundaria y crean un grupo de vigilantes en su vecindario. Pero, a medida que su poder aumenta, se vuelven más abusivos y peligrosos.",1hr 34 min,https://pluto.tv/on-demand/movies/650b0d29f6f05d0013af33b2
Sobre la ley,"Cuando un ex detective se entera del asesinato de su hijo , se aventura a regresar a las calles oscuras que una vez conoció tan bien. Armado, peligroso y sin nada que perder, debe enfrentarse a la despiadada mafia local en su misión de venganza.",1hr 29 min,https://pluto.tv/on-demand/movies/64021c5a653b4e0013096861
Atrapen Al Gringo,"Un criminal capturado por las autoridades mexicanas es enviado a una prisión de mala muerte, donde debe recibir la ayuda de un niño de 10 años.",1hr 36 min,https://pluto.tv/on-demand/movies/6549364e2a6001001ab5604a
Kickboxer,"Cuando el campeón americano de kickboxing queda inválido al enfrentarse a un despiadado campeón tailandés, su hermano jura vengarse.",1hr 37 min,https://pluto.tv/on-demand/movies/656dfe8c12fb50001393911b
El Guardaespaldas,"Un policía de Los Ángeles vuela a Nuevo Mexico para trabajar como guardaespaldas de la hija de un poderoso hombre de negocios. Cuando unos gángsters la raptan, él los busca para rescatarla y protegerla.",1hr 34 min,https://pluto.tv/on-demand/movies/60c8abe036537d0013320c0e
La Armadura de Dios,"La ex novia de Asian Hawk (Jackie Chan), una cazadora de tesoros y su mejor amiga actual son secuestradas por villanos. Para ayudar a rescatarla, tendrá que encontrar la Armadura de Dios, que hace que quien la lleve sea invencible.",1hr 38 min,https://pluto.tv/on-demand/movies/5f9af29a397eee001abb24ef
"Conan, el bárbaro","Hace muchos años, los brujos crearon la Máscara de Acheron y las fuerzas oscuras de Acheron conquistaron el mundo. Sin embargo, los bárbaros vencieron a los guerreros Acheron y rompieron la Máscara en pedazos y se dividieron entre las tribus.",1hr 52 min,https://pluto.tv/on-demand/movies/5e552dc95c1e25001a24f3a0
Until Death,Jean-Claude Van Damme interpreta a un teniente sucio al que le gusta la heroína. Es amigo de los mafiosos del crimen organizado y todos lo odian.,1hr 46 min,https://pluto.tv/on-demand/movies/5e9da6c03f9336001a5ddf0f
The Myth,"En 221 A.C, Qin Shihuang, el primer emperador de China, comenzó a construir una tumba real a pesar de pretender ser inmortal.",2hr,https://pluto.tv/on-demand/movies/5e5ff369e2fa10001bebda56
